{
  "task": "Review the Itô's lemma explanation and geometric Brownian motion derivation",
  "sources": [
    "AGENTS.md",
    "CONTEXT.md",
    "ref/thesis/plan.md",
    "judge/prompt.md",
    "judge/score.schema.json",
    "git diff -- ref/final_report/thesis_structure.tex",
    "ref/final_report/thesis_structure.tex",
    "ref/final_report/thesis_structure.pdf",
    "ref/final_report/thesis_structure.aux",
    "ref/final_report/thesis_structure.log"
  ],
  "scores": {
    "requirements": 30,
    "correctness": 25,
    "verification": 20,
    "grounding": 15,
    "maintainability": 10
  },
  "findings": [],
  "total": 100,
  "pass": true
}
