{"task":"Prelaunch cold review of two-input hidden-128 SiLU-LSTM validation fit","sources":["AGENTS.md","CONTEXT.md","ref/thesis/plan.md","ref/implementation_plan/lstm_val_training.md","judge/prompt.md","judge/score.schema.json","models/silu_lstm.py","models/base_lstm.py","models/variance_neural.py","models/variance_fit.py","models/training_blocks.py","models/lstm_val_sweep.py","models/tests/test_log_volatility_inputs.py","data/data_fetching.py","data/roughness_analysis.py","inference/checkpoints/silu_lstm/garman-klass/global/silu_lstm_gk_logvol_intradayret_w20_h128_preflight/fit.pth","git diff and git diff --check","direct focused test invocation and independent preflight forecast check"],"scores":{"requirements":30,"correctness":25,"verification":20,"grounding":15,"maintainability":10},"findings":[],"total":100,"pass":true}
