{
  "task": "Review the full-panel Garman–Klass base LSTM no-gradient-clipping trial setup while preserving the interrupted clipped trial",
  "sources": [
    "AGENTS.md",
    "CONTEXT.md",
    "ref/thesis/plan.md",
    "ref/implementation_plan/lstm_val_training.md",
    "judge/prompt.md",
    "judge/score.schema.json",
    "git diff and git status --short",
    "models/variance_fit.py",
    "models/variance_neural.py",
    "models/lstm_val_sweep.py",
    "models/base_lstm.py",
    "models/test_training_curves.py",
    "models/test_lstm_val_sweep.py",
    "models/test_neural_forecast_floor.py",
    "models/training_blocks.py",
    "wandb/lstm_val_training/results.json",
    "wandb/lstm_val_training/logs/base_lstm_vol_gk_w20_h16_lr0.0001_noclip_preflight.log",
    "Focused checks rerun: python -m models.test_training_curves, models.test_lstm_val_sweep, models.test_neural_forecast_floor"
  ],
  "scores": {
    "requirements": 30,
    "correctness": 25,
    "verification": 20,
    "grounding": 15,
    "maintainability": 10
  },
  "findings": [],
  "total": 100,
  "pass": true
}
