{
  "task": "Cold review of the latest thesis correction: plain Global/Local combination ratio, placed last, without percentage scaling.",
  "sources": [
    "AGENTS.md",
    "CONTEXT.md",
    "ref/thesis/plan.md",
    "ref/implementation_plan/technical_evaluation.md",
    "judge/prompt.md",
    "judge/score.schema.json",
    "judge/technical_ratio.diff",
    "judge/technical_ratio_before.tex",
    "judge/technical_ratio_checks.md",
    "judge/check_technical_evaluation.py",
    "ref/final_report/thesis_structure.tex",
    "ref/final_report/thesis_structure.log",
    "judge/ratio_preview-35.png"
  ],
  "scores": {
    "requirements": 30,
    "correctness": 25,
    "verification": 20,
    "grounding": 15,
    "maintainability": 10
  },
  "findings": [],
  "total": 100,
  "pass": true
}
