{
  "task": "Use L as the SARIMA lag operator, with Lx(t) = x(t-1) for a generic series x; preserve unrelated user edits.",
  "sources": [
    "AGENTS.md",
    "CONTEXT.md",
    "ref/thesis/plan.md",
    "ref/implementation_plan/methods.md",
    "judge/prompt.md",
    "judge/score.schema.json",
    "judge/reviews/sarima_l_before.tex",
    "judge/reviews/sarima_l.diff",
    "ref/final_report/thesis_structure.tex",
    "ref/final_report/thesis_structure.log",
    "ref/final_report/thesis_structure.synctex.gz",
    "judge/reviews/sarima_l_page-23.png"
  ],
  "scores": {
    "requirements": 30,
    "correctness": 25,
    "verification": 20,
    "grounding": 15,
    "maintainability": 10
  },
  "findings": [],
  "total": 100,
  "pass": true
}
